theme,variant,goemotions_id,text,emotion_labels,word_count,selected
guilt_shame,failure,eeeobwh,"Nah, you should have just listened when I tried to warn you about fake ",disappointment,14,
guilt_shame,failure,eej5h7h,This kid now: fun yay hahoo This kid as a grownup: I regret everything,remorse,14,
guilt_shame,failure,efakc1k,I'm a little disappointed that the tier markings werent' just different shades of green.,disappointment,14,
guilt_shame,failure,eenar60,I really don't think healthy people with no other emotional issues regret having their kids.,sadness,15,
guilt_shame,failure,ef6kift,Yes that would've been so much fun! You can only imagine my shock and disappointment...,"amusement, disappointment",15,
guilt_shame,failure,eew1mx7,I regret that I have but one upvote to give for your post. Very powerful.,remorse,15,
guilt_shame,failure,ef22wm8,I am vuri disappointed in you. You gained turdy pounds tis munt. Scale dont lie,disappointment,15,
guilt_shame,failure,ed8t0es,Sorry I should have been more specific! A spiral chemical perm (I love curly hair!),remorse,15,
guilt_shame,failure,ee7j6q5,I mean yeah we were the best counter attacking team. That counter was so disappointing,disappointment,15,
guilt_shame,failure,ed2qpz3,This cheat... what would that be? I may have made a choice I'm currently regretting.,"curiosity, remorse",15,
guilt_shame,failure,ee90qo7,I can understand political acrimony but the death of humor is really disappointing. Very sad indeed.,"disappointment, sadness",16,
guilt_shame,failure,efda7ub,"I peed off my deck at -30 yesterday, very disappointed when it didn’t freeze before impact.",disappointment,16,
guilt_shame,failure,eff051i,I'm just glad I've never heard of this game before otherwise this news would be disappointing.,disappointment,16,
guilt_shame,failure,eed2hix,"This show has completely gone downhill, can’t believe I waited a month to be disappointed smh",disappointment,16,
guilt_shame,failure,edu6aly,"I really get that, it's soooo disappointing. I hope he can make it up to you.","disappointment, optimism",16,
guilt_shame,failure,ed96hfp,Sorry I failed to mention I'm relatively new to the scene . Last 2 years only,sadness,16,
guilt_shame,failure,ee1nqb6,"No one ever laid on their death bed and said, “I regret not working even harder.”",remorse,16,
guilt_shame,failure,eesfava,I should have known what awaits behind the oilymama hashtag and yet I searched. Now I’m sad.,sadness,17,
guilt_shame,failure,eepekg2,And now I regret not applying when they opened one in my town even more now. Good times.,remorse,18,
guilt_shame,failure,eem26mm,I high key thought this same thing then it was sad boy hours when I broke things up,sadness,18,
guilt_shame,failure,ed6u9yq,"Yeah I regret ever moving to Leduc. It's one of the most backwoods, proud-to-be-ignorant communities I've ever seen.",remorse,18,
guilt_shame,failure,ef8he49,"I regret not grabbing my work laptop today, then I wouldn't have to leave fort blanket until Thursday. ",remorse,18,
guilt_shame,failure,eddbin6,"Same. You all tried to save me, but I rewatched with the sound on and... I have regrets.",remorse,18,
guilt_shame,failure,eeo7rbo,I've seen a number of them on there. I regret seeing most of them but some are legit movies.,remorse,19,
guilt_shame,failure,ef5csla,Is it wrong that I've been really disappointed that I haven't gotten to try out my new snowblower? :-/,disappointment,19,
guilt_shame,failure,eemreum,That's so disappointing. I'm sorry that happened to you. It really is hard to make friends as an adult.,"disappointment, remorse",19,
guilt_shame,failure,edg773x,"Yep! And the buns seemed so much fresher then. Last time I went, years ago, it was terribly disappointing.",disappointment,19,
guilt_shame,failure,ed9y68k,"Tried it. Failed it. Got mental consequences, my memory wont recover after half a year. You will regret it.",sadness,19,
guilt_shame,failure,ee7toae,That was my mistake. It should only show your First Name and The 1st letter of my last name.,remorse,19,
guilt_shame,failure,ef74sqr,"Sorry, should have searched for the artist's name. Karma Decay is a lot less reliable than I thought it was.",remorse,20,
guilt_shame,failure,ee78u95,And yet you're still not making me regret being a TV hodad when that was on and so missing it.,remorse,20,
guilt_shame,failure,een85dk,"I’m sorry men, I have failed you. My rigidity was no match for the flaccid effort our boys showed tonight",sadness,20,
guilt_shame,failure,eebhrde,"Sorry, I should have clarified that I meant when they determine your eligibility/payments in regards to the Repayment Assistance Program.",remorse,20,
guilt_shame,failure,edyct46,"Ugh, I have 2 cats as well and I wish for this every single day. I am, so far, constantly disappointed.",disappointment,21,
guilt_shame,failure,edx5vic,"I would not be that mad though. Just disappointed. I am angry at people like you, not the show in itself.","anger, disappointment",21,
guilt_shame,failure,ef81pgd,i'm really disappointed this isn't a real sub because i know there are soo many good notes to go in there,disappointment,21,
guilt_shame,failure,ee292if,I still think he should have been the first goalie in the 2014 World Cup. But alas that injury ruined everything.,sadness,21,
guilt_shame,failure,ee9ef98,I killed them for the first time in my most recent playthrough and regretted it. The replacement council sucks just as hard.,remorse,22,
guilt_shame,failure,eevvj5z,Oke thats really disappointing of him. Although his thoughts are constanly changing. He used to even be an ancap at some point.,disappointment,22,
guilt_shame,failure,ed42tzb,i managed to craft that super early in the game and i was so disappointed that i basically could not get drunk,disappointment,22,
guilt_shame,failure,ee193ye,I hope she will. I will regret it until she does and even after that I may still regret all I did.,"optimism, remorse",22,
guilt_shame,failure,eezkoeb,You are entitled to live your life the way you want to. I never said you weren't. You really are just disappointing.,disappointment,22,
guilt_shame,failure,ee75js5,"No, I was very interested in the game until this news broke. Now I’m a little disappointed. But at least I can opt-out. ",disappointment,23,
guilt_shame,failure,ee4db6k,I'm hopeful but going in with tempered expectations. There have been some remasters in which I was really disappointed. BioShock comes to mind.,"disappointment, optimism",23,
guilt_shame,failure,eec1q33,"Thank you, and I am. I'm definitely fine with regretful parent, I'd flair myself that if I had an actual computer at hand.","gratitude, optimism, remorse",23,
guilt_shame,failure,ef3e1sc,Realize that no girl is perfect for you if you're not perfect for her. I feel for your disappointment tho. Keep on truckin'.,disappointment,23,
guilt_shame,failure,ef80ro5,The second half of the game was a big disappointment for me. I really wish they kept the family around for much longer.,disappointment,23,
guilt_shame,failure,ee4b70h,I had 175/1 back in March. About to go to Vegas again and it will be disappointing to only get 12/1 this time.,disappointment,23,
guilt_shame,failure,efavn0v,I agree!!! His character has grown so much throughout the entire series and I was very disappointed that he ended up with her.,"approval, disappointment",23,
guilt_shame,failure,ed0i4fk,"I apologize, that sincerely was meant for Askreddit. If you look at my history you'll see that's where I always post. My mistake.",remorse,23,
guilt_shame,failure,efcxfdz,I laughed harder than I should have at this reply. Then the sadness hit me when I realized it wasn't meant to be funny.,"amusement, sadness",24,
guilt_shame,failure,ef0ya2m,"Dentist did this to me I hate it. I knew i should have waited until ""it wad worse"" but i didn't. I regret it ","disgust, remorse",24,
guilt_shame,failure,eds6o2p,I was just a little disappointed that there is no audible/visible reaction by the character when visiting the graves (also trying to avoid spoilers).,disappointment,24,
guilt_shame,failure,ef89weh,"Hi Tired, I'm Dad. And I'm very disappointed in you for following your older brother's example and becoming a trap that poses for /b/",disappointment,24,
guilt_shame,failure,eeo310q,"I see, Unfortunately I don't think equity has ever turned out well in history. Humans have tried many times and failed with catastrophic consequences.","disappointment, neutral",24,
guilt_shame,failure,eejhlt1,My one regret is not making an account sooner. I lurked for a long time because I felt like I didn't have anything worth saying.,remorse,25,
guilt_shame,failure,ee96eac,That guy is gonna regret losing you the rest of his life. You know why i know this? Because i am him 30 years ago.,sadness,25,
guilt_shame,failure,edls65i,"Actually good point, I should have asked for the source their too. It was only a rumor when I first heard. Might be wrong, sorry.","approval, realization, remorse",25,
guilt_shame,failure,eeqtqq6,Some rambling paragraphs about what a waste I am and how sorry I am to be a disappointment to those around me and that sort.,disappointment,25,
guilt_shame,failure,edutero,YES! I can't recommend this TED Talk enough and I think it's really disappointing that many portions of the left have caved in to anti-nuclear hysteria.,"annoyance, disappointment",26,
guilt_shame,failure,eerm1dc,I'm not a gamer but I always feel bad if I kill an ant or some other bug like that for no reason :( instant regret,"remorse, sadness",26,
guilt_shame,failure,ees2qze,I am more of a dumbass for building a $2500 308 AR-10 for my first rifle... regret it but just not willing to sell it till this day,remorse,28,
relationship_distress,enmeshment,ee41n3f,"I don't control the Lib Dems, shockingly.","annoyance, surprise",7,
relationship_distress,enmeshment,ef1ypgj,I'm only saying it because I'm jealous :(,annoyance,8,
relationship_distress,enmeshment,eet82j6,It's a prime-time soap. I feel so guilty.,"disappointment, sadness",8,
relationship_distress,enmeshment,ee21y05,Because I have no self-control and I hate myself.,"anger, remorse",9,
relationship_distress,enmeshment,edsn4s6,"Great, now my balls hurt and I’m yawning uncontrollably. ","admiration, disappointment, sadness",9,
relationship_distress,enmeshment,ee1js7l,"If I’m ever like that, suffocate me with a pillow.",annoyance,10,
relationship_distress,enmeshment,eepmyc4,Guilty :( I was ready to cry and everything >:(,sadness,10,
relationship_distress,enmeshment,ee33ub2,I'm jealous. Wish I was in fl on my porch.,annoyance,10,
relationship_distress,enmeshment,ee23ppc,I am so sorry to hear about your wife’s tragic injury.,"grief, sadness",11,
relationship_distress,enmeshment,ee9l5e3,Animal Crossing made my wife into a vicious and abusive murderer.,sadness,11,
relationship_distress,enmeshment,ed4m0qz,My husband and I have been circling the drain for years. :(,sadness,12,
relationship_distress,enmeshment,edbla8u,"Fuck, my wife and I spent less than a *fifth* of that. Wow. ",anger,13,
relationship_distress,enmeshment,eevep1z,A lack of the romantic partner is the stressful situation in my life.,sadness,13,
relationship_distress,enmeshment,ef2bgll,My wife is out for shabbos and I'm so lonely without her :(,"disappointment, sadness",13,
relationship_distress,enmeshment,edafb8b,"It depends on who you ask. i didnt downvote you, im answering now",annoyance,13,
relationship_distress,enmeshment,efg59zj,"Well shit, time to talk to the wife. It appears she has two husbands.",annoyance,14,
relationship_distress,enmeshment,eev1ygb,"Each Dark Souls game has been voted ""Most Likely to Result in Controller Damage"".",anger,14,
relationship_distress,enmeshment,eersrrt,People are idiots....sheep don't magically become independent thinkers just because their food source changes,annoyance,14,
relationship_distress,enmeshment,edlph1i,In my experience I've also noticed his friends and got ditched by my girlfriend.,"realization, sadness",14,
relationship_distress,enmeshment,eear3qq,> Sleeping next to someone I knew my wife is trying to kill me!,fear,14,
relationship_distress,enmeshment,edn78m5,"""I lost control"" would have been an understandable explanation. ""It lost control"" is not. ",anger,14,
relationship_distress,enmeshment,eewzssb,I literally screamed uncontrollably for 3 months and ended up in a mental hospital.,"nervousness, sadness",14,
relationship_distress,enmeshment,ed60uu5,I too rationalize how bad my my ex-girlfriend is now that she's gone. 8(,"realization, sadness",14,
relationship_distress,enmeshment,edlrijc,Sadly my boyfriend's family is the direct opposite but we'll still make it work :3,"disappointment, sadness",15,
relationship_distress,enmeshment,edhovhi,This genuinely made me angry. He and his sociopath of a wife deserve each other.,anger,15,
relationship_distress,enmeshment,eelmplg,I actually like my vagina... I suspect it’s actually my husband that is the problem,annoyance,15,
relationship_distress,enmeshment,eex96mt,"Well he abused his previous girlfriend, he ran a porn site that's what I know",annoyance,15,
relationship_distress,enmeshment,eeazr8x,"Cut rent control, then increase own housing allowance. Because fuck everybody else, am I right?",annoyance,15,
relationship_distress,enmeshment,eegaxvs,"“1, personal space. 2, I like my personal space. 3 get outa my personal space...”","anger, love",15,
relationship_distress,enmeshment,ef1p2ma,Beat my second wife cuz obviously she put the evil eye on my first wife,"anger, annoyance",15,
relationship_distress,enmeshment,edmcjnx,"Yeah seriously! I saw the controller and I thought ""don't do it, don't do it!""","fear, neutral",15,
relationship_distress,enmeshment,eeao04e,Yes! What the hell is it with ikea? My husband and I don’t go together anymore.,"anger, annoyance, disappointment",16,
relationship_distress,enmeshment,efbfiky,Or the long con. My Dad guilted me into taking care of my Grandmother for her.,annoyance,16,
relationship_distress,enmeshment,ed3z9cr,Yup. How sad is it to admit I'm jealous of the ravens run game and defense 😣,"disappointment, sadness",17,
relationship_distress,enmeshment,ee15az7,This is the noise I make in my girlfriend’s ear while y’all are still scared to moan,fear,17,
relationship_distress,enmeshment,eepoo9w,"Can confirm, playing a game of checkers is the one occasion I get to smash my wife",annoyance,17,
relationship_distress,enmeshment,edxso3y,Beautiful yet sad that his relationship ended in ‘45 the same way most of mine do...with cheating,sadness,17,
relationship_distress,enmeshment,ef80dwz,"Ugh I never thought I'd be someone that gets jealous about shoes, which ones did you get?",annoyance,17,
relationship_distress,enmeshment,eea95mz,"A girl bashed my then girlfriends head in with a cane, she didn't even get jail time. ",anger,17,
relationship_distress,enmeshment,edzmmv7,"Considering that cheating is a mark of high-status, I'd be surprised if the wife dumped a cheating husband.",annoyance,18,
relationship_distress,enmeshment,edbyfsl,She might just be bitter over her own relationship and this is a painful reminder in some way.,sadness,18,
relationship_distress,enmeshment,ee8pd9h,It's been over a decade since consoles decided to mandate wireless controllers and I'm still annoyed by it.,annoyance,18,
relationship_distress,enmeshment,eeq5rhg,All I'll say is when I can smell it walking down the street it makes me very jealous.,annoyance,18,
relationship_distress,enmeshment,ef02ir1,"the game certainly feels unfinished, at least on PC. some horrible mouse controls, using a controller is almost necessary.",annoyance,19,
relationship_distress,enmeshment,ef95ek1,"Oh damn, that would have been the only correct response! ""Sorry, but I have a boyfriend."" End of conversation.",sadness,19,
relationship_distress,enmeshment,eeldagg,I got mine at 21. The ex wife would have had me snore instead of wear it for years.,"sadness, neutral",19,
relationship_distress,enmeshment,ed8wq2w,I'm so sorry that your partner doesn't understand that you no longer want to put hormones in your body.,sadness,19,
relationship_distress,enmeshment,eemahay,"INFP. I’m a very selfless person, which helped me find friends, but not a love interest or a partner",sadness,19,
relationship_distress,enmeshment,ed4hxuv,My wife with BPD hasn't even kissed me in over a year. Get used to it if you're sticking around.,sadness,20,
relationship_distress,enmeshment,ef615f2,I just have a controller on my desk that I turn on when I fly. I've always hated mouse flying.,"annoyance, disapproval",20,
relationship_distress,enmeshment,edu1m9o,The Republicans are worse though the NRA literally has to pressure Republican congressmen every time gun control gets brought up.,"annoyance, disapproval",20,
relationship_distress,enmeshment,ed596fh,I didnt really think about having a wife as an object until recently in a bout of frustration induced fantasy.,"annoyance, neutral",20,
relationship_distress,enmeshment,eevackj,"My girlfriend's creepy uncle gets extremely triggered when I point this out, or that a lot of conservatives are gigantic fudds.","anger, disgust",21,
relationship_distress,enmeshment,efgf2km,I constantly feel like I'm my husband's best friend and it's just a matter of time until we break up :(,annoyance,21,
relationship_distress,enmeshment,eeqigk9,"Are you implying that I can not determine guilt by seeing a person's skin color and tense smile, you fucking racist?",anger,21,
relationship_distress,enmeshment,edpiohy,Bitch real man just panicking purchases a m82 barret..Now excuse me while i hide from my wife for the next month.,fear,21,
relationship_distress,enmeshment,ef94f03,Wife left me and I am just broken. relapsed tonight from 7 years clean and just not seeing a point anymore,sadness,21,
relationship_distress,enmeshment,ef4bosy,"Find a better partner. It's past time to move on! He sounds very lazy, selfish, and he doesn't care about your needs.","annoyance, caring",22,
relationship_distress,enmeshment,ef8ewsw,"Ha, my husband goes out after you guys have done your thing and checks for himself, he's been burned too many times.",anger,22,
relationship_distress,enmeshment,ef852by,Ugh I am in this same place right now. Dating a husband whose wife calls all the shots. I feel for you.,sadness,22,
relationship_distress,enmeshment,eevpjrs,"My best friend waited 5+ years for her boyfriend in prison to come out. Two days before coming out, he dumped her.","disappointment, sadness",22,
relationship_distress,enmeshment,eew50i8,"Poor lady, she was the mother of a friend of my wife, and she went to school with my father in law :(",sadness,23,
relationship_distress,enmeshment,eetfij8,I'm not a jealous person. That's not an emotion that comes naturally to me. I wouldn't try to cultivate it or maintain it.,"annoyance, disapproval",23,
relationship_distress,enmeshment,ef9wlwj,"Considering the fact that I don't consider jealousy or envy useful, you are dead wrong. It might be other people but not me.","annoyance, disapproval",23,
relationship_distress,enmeshment,eda8ukp,"""Oh, when you were an infant you wanted to be around me ALL THE TIME! Your evil wife must be why you changed!"" ","anger, realization",23,
relationship_distress,enmeshment,edy8de2,"I haaaaaate vanilla scents and they are a 100% NOPE for me. I wear more neutral/woodsy scents and boyfriend loves it, so win.","anger, love",23,
relationship_distress,enmeshment,ee18lyn,I tell them my wife died in a car accident 10 years ago and I couldn’t fall in love again. I’ve never been married.,"grief, sadness",24,
relationship_distress,enmeshment,ee1cddm,"My girlfriend barely tolerates me showering in the morning, she'd be furious if I'd let an alarm ring while I'm away. And rightfully so. ",anger,24,
relationship_distress,enmeshment,eeitn01,"Not at all. It's great of course for financial reasons, but it then makes me worried about how much time she'll have for a relationship.",sadness,25,
relationship_distress,enmeshment,efdoozh,I hate his hoist a shit shot and throw your legs forward so you can draw a foul on the defender for crowding your landing space.,anger,26,
relationship_distress,enmeshment,ed51srg,"Well then I feel sorry for men for being such incontrolable sexual beasts I guess. My original answer was sincere, I can't speak for others though.","annoyance, remorse",26,
relationship_distress,enmeshment,ef7vxhx,I’m always reminded by my relatives on my birthday asking me if I have a girlfriend yet. Sorry bro ima yeet out of the social norm.,sadness,26,
relationship_distress,enmeshment,edfcumq,"This hits hard, sadly both of my relationships have been toxic so I've decided not to start any new ones until I start going to uni ",sadness,26,
relationship_distress,enmeshment,eevhdmf,"Yeah I meant to say the purpose ofnbeing an independent is ""so one can remain annoyingly aloof about primaries and then vote any way in the general""",annoyance,27,
relationship_distress,enmeshment,ed6g66v,Someone tell me why they are out passing us they taking the game to us when we should be controlling the tempo of the ball to keep the lead.,anger,29,
