theme,variant,goemotions_id,text,emotion_labels,word_count,selected
anhedonia,disconnection,edx6edl,These style skins remind me so much of hollow knight,neutral,10,
anhedonia,disconnection,ee13zje,I tell myself that but when I’m at 90 I’m like a zombie,neutral,13,
anhedonia,disconnection,ef8hlyp,SO FAR I couldn’t even listen to all of zombie bastards and ckth was mediocre,neutral,15,
anhedonia,disconnection,eej1i81,You won't have time for extra tasks. Anything extra u do will become ur daily routine.,neutral,16,
anhedonia,disconnection,ed0phh5,"It's the same with librarians. Out someplace, see someone with a confused look, and that autopilot kicks in. ","approval, neutral",18,
anhedonia,disconnection,efaaoid,Me when I distract the last zombie so my friends can work on the Easter egg without starting the next wave,neutral,21,
anhedonia,flatness,eer2wt8,It's the number it came from,neutral,6,
anhedonia,flatness,ef3qvbg,I'd actually really like to see the numbers.,neutral,8,
anhedonia,flatness,edepu8z,Gotten death threats and people compare me to flat earthers.,neutral,10,
anhedonia,flatness,edwciq5,Is this news? I don't feel like this is news.,neutral,10,
anhedonia,flatness,ee90yrm,I wonder what number he'll wear since he can't wear 20.,neutral,11,
anhedonia,flatness,eedme6b,Some do. Some don't. Blanket generalizations are almost always false and unhelpful.,neutral,12,
anhedonia,flatness,efe2u40,"I would assume it's for OP, so her parents don't recognize his number.",neutral,13,
anhedonia,flatness,eezkw84,Someone who’s to sad and empty to care about toast... me I guess?,"curiosity, sadness",13,
anhedonia,flatness,edfbz1j,Not without espousing blanketed partisan political opinions that will get me a million downvotes,neutral,14,
anhedonia,flatness,edgpply,breaking news: sports fan does something extreme and stupid over something that doesn't matter,neutral,14,
anhedonia,flatness,ee6veit,"If everyone is wrong I'll still point out that everyone is wrong, doesn't matter.",neutral,14,
anhedonia,flatness,ed2fc1s,That’s why I have a separate work number - I can just shut it off.,neutral,15,
anhedonia,flatness,ed1ty0c,"I had a 2 litre bottle. It went flat before I opened it, nearly wept.",neutral,15,
anhedonia,flatness,ee5jpa2,Especially if he looks good in your bra and panties ...can he give me his number?,neutral,16,
anhedonia,flatness,efdeeie,"3 is a really significant number for the Super Bowl, I don't think it will budge.",neutral,16,
anhedonia,flatness,edy85fc,"Suns fan here, I firmly believe you guys keep number one. Just having a bad game ","disappointment, optimism",16,
anhedonia,flatness,edib0iy,I've never been so bored with so much money on the line. I am numb now.,neutral,16,
anhedonia,flatness,eefjo93,"I know, I'm training. Only a semi-cursed word with a number as the user seems coincidental.","approval, neutral",16,
anhedonia,flatness,eem2vx9,I get ya. If thinness was something I could buy I'd be flat broke by now,neutral,16,
anhedonia,flatness,eezm715,"I've felt number 2 so hard. ""Working hard for what you don't want"" is a thing. :(",neutral,17,
anhedonia,flatness,ef8ka3k,I carry on an empty. But I also carry a single action. So don't make my mistakes.,neutral,17,
anhedonia,flatness,eeobvz1,"Now, could you please turn the card around and show me those wacky three numbers on the back. ",neutral,18,
anhedonia,flatness,eeo7kle,"Seriously, it would make me sad to stop caring about my kid because they had x number of birthdays. ",neutral,19,
anhedonia,flatness,edbsn0w,You can't reason with some people. This person said people call 911 (emergency number) when they see his face.,neutral,19,
anhedonia,flatness,eds3pym,"I got the same call, voicemail was definitely Chinese but I deleted it and marked the number as Spam/Blocked ",neutral,19,
anhedonia,flatness,eerp2ah,The number of songs I've written that no one will hear. I've been working on some for 8+ years.,neutral,19,
anhedonia,flatness,edw1i4a,"That used to be my favorite view on the planet, but now it’s just rage. I can’t look anymore.","admiration, annoyance, disappointment, love",19,
anhedonia,flatness,edpx03t,"I don't think abortion is murder, but it's factually way less easy to disprove than the earth being flat.",neutral,19,
anhedonia,flatness,edoejpx,I already told him off and typing the number into Facebook came back with a whole bunch of nothing.,neutral,19,
anhedonia,flatness,educoe4,"They spoofed their number, unfortunately (you know, time travel rules and all). Also: > older ~~then~~ my joke. than* :D",neutral,20,
anhedonia,flatness,edesuxc,Heart races everytime I get a match. Oddly enough I don't feel that at all playing offline with my friends.,neutral,20,
anhedonia,flatness,eeev1qc,"The correct response for OP: ""In that case... Would you like to watch a porno on my flat screen mirror?""",neutral,20,
anhedonia,flatness,ed9bs7b,"Without bots, I doubt the opposition numbers a million. It's all paid Brock-bots and Twitter Trolls all the way down.",neutral,20,
anhedonia,flatness,ed2n9a7,"Granted, I dont have a proper measure of the number of monkeys needed to hash $0.05 worth of tx fees.",neutral,20,
anhedonia,flatness,edlsw9l,Well it does appear to be a gold/bronze Cadillac. And I think I see a flat bill in the front seat.,neutral,21,
anhedonia,flatness,ef9urao,I did this with tuna salad. I already ate tuna a lot (at the time) and it’s a decently blank slate.,neutral,21,
anhedonia,flatness,edf9x88,"Death treats are for immature people, I'm sorry you received them. Comparing you to flat earthers is not far off though.",sadness,21,
anhedonia,flatness,eedf692,My point is that since they should both get the same sentence...it doesn't matter who is who. Push them both in...,neutral,21,
anhedonia,flatness,efe3hza,"My saving grace: “Since we have an odd number of students, is there anyone who’d prefer to work alone for this project?”",neutral,22,
anhedonia,flatness,edlo38w,I read a news piece 10-15 years ago about how much garbage China dumps at sea. The numbers were staggering back then.,neutral,22,
anhedonia,flatness,ef47czr,"Haha it could be! As much as I love supporting small, local grocers they tend to inflate the price on specialty products. ",neutral,22,
anhedonia,flatness,ed1vnka,"If someone asked me, “what truly stood out to you as a memory from this year,” my mind would be completely blank.",neutral,22,
anhedonia,flatness,eeosw94,I actually find it easier to place spawn beacons in stupid spots like this than a nice flat empty piece of ground.,"approval, neutral",22,
anhedonia,flatness,ee6c630,I don't feel alive anymore. I don't feel anything. I'm just numb all over. All I know is I want it to stop,sadness,23,
anhedonia,flatness,eeaz423,"You are disregarding that the Iran hostage crisis happened just years early. Iran was public enemy number 2, second only to the Soviets.",neutral,23,
anhedonia,flatness,efa72y4,"The numbers in my head were (-90,-120). Upon closer inspection, yours are closer. Those two are added together for Total Points Added, no?",neutral,23,
anhedonia,flatness,ef1r2so,"I have, but like I said, I can see women that can’t find love existing, just not in the same numbers as men",neutral,23,
anhedonia,flatness,ee9ph55,I know he lives in Texas and I have his phone number and things like his name and age but nothing else really.,"approval, neutral",23,
anhedonia,flatness,edu52qj,"My ctrl+f on 'made man' and 'unfireable' both came up empty, not sure why they're appearing in quotes on the title of the post",neutral,24,
anhedonia,flatness,ee3q2de,I just see two inflated peacocks with a dumb and disgusting look in their face. But unfortunately I am not the gender evaluating them.,neutral,24,
anhedonia,flatness,eetnvn9,Fair enough but I would imagine it's a small enough number that we can deal with. Don't throw the baby out with the bathwater...pun intended,"approval, neutral",25,
anhedonia,flatness,eemni1u,I always give my disclaimer when he asks for my phone number. I understand and respect my situation could be a deal breaker for some.,neutral,25,
anxiety_panic,insomnia,ed6q398,My nightmare is having an iphone.,"fear, joy",6,
anxiety_panic,insomnia,ed60o6e,One of my worst nightmares. Ugh.,fear,6,
anxiety_panic,insomnia,ed1ivu3,Oi he got stabbed in the eye,sadness,7,
anxiety_panic,insomnia,eers4o4,I don't like sleeping in the couch :(,"disappointment, sadness",8,
anxiety_panic,insomnia,eeqkb6e,"Moose is pretty underwhelming tonight, I miss JV","disappointment, sadness",8,
anxiety_panic,insomnia,eeh1oy6,"I'm kind of struggling tonight. Bored, lonely... man ",sadness,8,
anxiety_panic,insomnia,eervz66,I think you might be underestimating some people sadly.,"annoyance, disapproval, sadness",9,
anxiety_panic,insomnia,ef00z5k,This is horrible... One of my worst nightmares actually.,"disgust, nervousness",9,
anxiety_panic,insomnia,edv976f,Drunk and crying in bed with my pets. :|,"grief, sadness",9,
anxiety_panic,insomnia,ee6uw7u,I've had sleep paralysis once and it is really bad.,sadness,10,
anxiety_panic,insomnia,ee122e4,I’m stuck at work tonight so I missed it 😢😢,sadness,10,
anxiety_panic,insomnia,eetgsio,"Same, ASMR is nightmarish. My skin crawls just thinking about it.","fear, nervousness",11,
anxiety_panic,insomnia,ee68gqt,"I feel bad for house slaves, even if it's in their understandable self-interest. ",sadness,13,
anxiety_panic,insomnia,eewmsvg,I’m tired from working hard and I want someone to snuggle me to sleep,nervousness,14,
anxiety_panic,insomnia,eeoiiuu,I was getting arrested and my dog run away from home like a bullet,sadness,14,
anxiety_panic,insomnia,ef7f59p,"Jeter been enjoying the Miami nightlife a little too much maybe, dulled his senses. ","joy, sadness",14,
anxiety_panic,insomnia,eear3qq,> Sleeping next to someone I knew my wife is trying to kill me!,fear,14,
anxiety_panic,insomnia,effg9s5,"Weird, FBI did an investigation and proved that never happened. White knights make me cringe.",fear,15,
anxiety_panic,insomnia,ee462jl,Shit's going down in Zim. 6 people killed yesterday by army and over 200 arrested.,sadness,15,
anxiety_panic,insomnia,edkkofx,GF is false; I saw Mayor get transported and I was stabbed by an SK,fear,15,
anxiety_panic,insomnia,edclugt,These refs are remarkably terrible tonight. So are the sabres but wow some terrible calls.,fear,15,
anxiety_panic,insomnia,edl0owx,"Sorry, didn’t realize I was talking to a fan of the prestigious UCLA Bruins football program.","realization, sadness",16,
anxiety_panic,insomnia,eepx8q5,"I know, right?! I was literally in tears Saturday night 😪 It's only 3 years old!!","curiosity, sadness",16,
anxiety_panic,insomnia,eetk69f,It’s one of my worst nightmares to have skin like that...I hope that person gets actual help,sadness,17,
anxiety_panic,insomnia,edciwc1,"I had a nightmare about something similar, the combination of high walls and water is truly scary",fear,17,
anxiety_panic,insomnia,efar486,I don't have children yet so I will just have a long conversation with my balls tonight,"disappointment, sadness",17,
anxiety_panic,insomnia,ee0wnfi,I haven't had class in three years and yet I've literally had this nightmare dozens of times.,fear,17,
anxiety_panic,insomnia,ed6ujiz,"omg what a nightmare, I feel for you 😞 is there any way you could order it online?","caring, curiosity, nervousness",18,
anxiety_panic,insomnia,edw9nyo,"Given my grandpaernts survived the holocaust and told us everything, we have a horrible yet interesting family humour. ","excitement, fear",18,
anxiety_panic,insomnia,eemahay,"INFP. I’m a very selfless person, which helped me find friends, but not a love interest or a partner",sadness,19,
anxiety_panic,insomnia,ed2qzhv,"I go to a neighborhood mexican restaurant monthly for the past 2.5 years, but nobody knows my name ☹","disappointment, sadness",19,
anxiety_panic,insomnia,ee4cv5g,"I don’t understand your question, why are you nervous if you are happy with the arrangement and he seems interested? ","confusion, nervousness",20,
anxiety_panic,insomnia,een85dk,"I’m sorry men, I have failed you. My rigidity was no match for the flaccid effort our boys showed tonight",sadness,20,
anxiety_panic,insomnia,ee2uzwc,"Quitting porn only helped with my performance in bed, other than that I’m still anxious as hell in social spots ",nervousness,20,
anxiety_panic,insomnia,efbfp6i,I was sad to see emails from multiple downtown restaurants offering free delivery through grubhub. Deliveries are going to be brutal.,sadness,21,
anxiety_panic,insomnia,efguwmy,I am practicing an speech for tonight when he drops by to see my dad. I am every level of nervous.,"approval, nervousness",21,
anxiety_panic,insomnia,ef94f03,Wife left me and I am just broken. relapsed tonight from 7 years clean and just not seeing a point anymore,sadness,21,
anxiety_panic,insomnia,edygru4,"Honestly, I have a hard time sleeping in socks. The fuzzy ones are the worst because they slide around on my feet.","anger, disgust, sadness",22,
anxiety_panic,insomnia,eef8et1,"That sounds like it was an absolute nightmare, I'm sorry you had to go through that, anesthetic failing is a horrifying experience. ",fear,22,
anxiety_panic,insomnia,edjgenn,I was scared of my room and even when I fell asleep in my bed I would sleep walk into my mom's room,fear,23,
anxiety_panic,insomnia,eembqq6,The saddest part is that just this morning when we were laying in bed I was thinking about how much I love him.,"love, sadness",23,
anxiety_panic,insomnia,edqix5l,There was a huge pervasive fear of nuclear war in the 80s among kids. I remember often waking up screaming from nuclear nightmares.,"approval, fear",23,
anxiety_panic,insomnia,ee972co,I'll try that but I'm thinking about going outside when it is unbearable to sleep. Also I'm scared of cold making me more sleepy.,fear,24,
anxiety_panic,insomnia,ee96eac,That guy is gonna regret losing you the rest of his life. You know why i know this? Because i am him 30 years ago.,sadness,25,
anxiety_panic,insomnia,ee99usi,"Since I was a kid I knew I preferred funny, smart, interesting girls to conventionally attractive ones. Really tore me up the feeling wasn't mutual.",sadness,25,
anxiety_panic,insomnia,ee9shnp,I know! Or close the door of the room where the baby is sleeping? It's too sad for the poor thing to be locked inside.,sadness,25,
anxiety_panic,insomnia,eenmvfw,"Pretty good, but I would put the bishop on B4 so that the Knight will be in danger of the queen after taking the bishop.","admiration, fear",25,
anxiety_panic,insomnia,ed052gn,"Got a bit tipsy in my room alone, dancing in my underwear to some cheesy music for the whole night, and then cried myself to sleep",sadness,26,
anxiety_panic,insomnia,eeuq8u4,I feel a tad lost without it now that my drive for football has vanished and basketball and hockey simmer one. The show's every night after all.,sadness,27,
anxiety_panic,insomnia,eed772k,"I am truly sorry, I did not realise you thought immigration had no bearing on brexit. I shall not overestimate your intellectual abilities in future, i promise.","realization, sadness",27,
anxiety_panic,insomnia,eezq59k,"Friend of the younger sister of girl who was killed. She told me it was a bad acid trip. Very sad, family is holding a vigil tomorrow night. ",sadness,28,
anxiety_panic,insomnia,eeaiy0n,I used to do the same exact thing! Now I love the fat on my steak and watching them cut it off in japanese restaurants makes me sad.,"love, sadness",28,
anxiety_panic,overthinking,efeqp2c,I just had a panic attack!,"fear, sadness",6,
anxiety_panic,overthinking,edumf9e,same but with panic at the disco,nervousness,7,
anxiety_panic,overthinking,edtra8x,Seeing people overtaking on the right makes me anxious.,nervousness,9,
anxiety_panic,overthinking,edts81m,The secondhand panic and embarrassment I feel from this is astounding,"embarrassment, fear",11,
anxiety_panic,overthinking,ef5zl3r,My worst fear when I finally get over someone Those damn what ifs,fear,13,
anxiety_panic,overthinking,eexbozv,"My first day with them off was quite anxious, but it got better!","nervousness, relief",13,
anxiety_panic,overthinking,eer50di,this made me stop subconsciously breathing and now I can't stop thinking about it,nervousness,14,
anxiety_panic,overthinking,ee3mvcv,What if I don't fully have feelings for her and just really like her cuteness,confusion,15,
anxiety_panic,overthinking,ed1k3yr,"Not really, in my mind it was continuous cringe that I was always curious about","curiosity, fear",15,
anxiety_panic,overthinking,eelgfhz,What if I dont want the service? Why should I be forced to purchase that service?,confusion,16,
anxiety_panic,overthinking,eeap4bc,"Yeah, for sure. I've definitely come pretty close to panic attacks at the dentist as well.","approval, fear",16,
anxiety_panic,overthinking,edcfuk0,"Yeah i know, i'm just stating why it slipped my mind, i'm glad you brought it up. ","confusion, joy",17,
anxiety_panic,overthinking,edfuqsg,Yeah I knew that game off the top of my head wasn’t sure if there was anymore,confusion,17,
anxiety_panic,overthinking,ednel2i,"As someone with sinus and breathing problems, this makes me anxious and short of breath just looking at it.","fear, nervousness",19,
anxiety_panic,overthinking,eeo8f34,I told their kid that it was okay to be upset. (He was anxious and I was validating his feelings.),nervousness,20,
anxiety_panic,overthinking,ee0fz73,"People will go mental hoarding food, so you should be hoarding food, not like those idiots that panic. I'm confused.",confusion,20,
anxiety_panic,overthinking,eefyz18,I am sorry but I can feel a panic attack. Holy moly I would die instantly If I were him,nervousness,20,
anxiety_panic,overthinking,ee2uzwc,"Quitting porn only helped with my performance in bed, other than that I’m still anxious as hell in social spots ",nervousness,20,
anxiety_panic,overthinking,edwthsb,also anxious that people will be angry or surprised or upset at me for me never telling people about this before,nervousness,21,
anxiety_panic,overthinking,ee3qtcw,"I had a panic attack when I saw that, thinking that I slept for 3 years and Hall was a Duck.","fear, nervousness",21,
anxiety_panic,overthinking,edpiohy,Bitch real man just panicking purchases a m82 barret..Now excuse me while i hide from my wife for the next month.,fear,21,
anxiety_panic,overthinking,ed0h5gk,"Yeah, I was thinking my boy was into them before that. But I doubt Panic! At the Disco would have peaked his interest.",confusion,23,
anxiety_panic,overthinking,ef8a2jr,I know people around here may mock me from my optimism but what if we get actual desings for the crusaders in Heroes?,"confusion, optimism",23,
anxiety_panic,overthinking,edbe4la,I find sativa makes me paranoid/anxious as hell. Indica calms me down more. Smoking too much of any strain makes me anxious by time though,nervousness,25,
anxiety_panic,overthinking,eerekx1,You are not wrong. I have learned about myself alot while on drugs. Sometimes it's scarry when i find out how limited my mind is.,fear,25,
anxiety_panic,overthinking,eemt5cf,"I've been putting off scheduling a dental appointment for a week because of this, I'm just too anxious to pick up the phone and dial. ",nervousness,25,
anxiety_panic,overthinking,efan4tt,I already called the county I got married in trying to find out about it but they had nothing on either of us about a divorce.. Im so anxious.,nervousness,29,
guilt_shame,burden,ed56ipe,"Wow that's a burden, I'm sorry.",sadness,6,
guilt_shame,burden,edjgny1,She was carrying all my burdens >:((,sadness,7,
guilt_shame,burden,efhc2b1,I just wanted my knees to stop hurting,"desire, sadness",8,
guilt_shame,burden,eeu5xfv,"I feel bad for her, talk to her :(","caring, sadness",9,
guilt_shame,burden,ee3xlfx,it's hurting my heart :( why did you leave me,sadness,10,
guilt_shame,burden,edjdu3a,yep. I feel guilty for throwing them out but they're basically useless.,remorse,12,
guilt_shame,burden,ef4e3zp,"Oh wow, I feel bad for the parents, they had no idea",sadness,12,
guilt_shame,burden,ee68gqt,"I feel bad for house slaves, even if it's in their understandable self-interest. ",sadness,13,
guilt_shame,burden,efgcmz0,"I'm underweight anyways, somebody hand me an English to (whatever language) translation book.",embarrassment,13,
guilt_shame,burden,eevxt4y,I feel bad for these guys. I'd like to be able to help ex-mos in trouble.,sadness,16,
guilt_shame,burden,ed6wdjv,I wish I could be you. Our thing is dragging on forever and I’m heartbroken af.,"desire, disappointment, sadness",16,
guilt_shame,burden,ed5429y,If you really think a horror movie needs jump scares then I feel bad for you son.,sadness,17,
guilt_shame,burden,efh991h,Breathing out like a dragon keeps me from gagging when i brush the back of my tongue,"sadness, neutral",17,
guilt_shame,burden,edfm4j7,"Dude I don’t even know what that guys deal is, but honestly, I feel bad for him",sadness,17,
guilt_shame,burden,eehooua,"My fault, I jumped to a conclusion. I forgot that savanna cats are spotted not leopard print.","embarrassment, realization, remorse",17,
guilt_shame,burden,edfe1cj,I feel bad for laughing at this now that the creator of Spongebob passed away a month ago.,sadness,18,
guilt_shame,burden,edypv52,I feel bad for that other little girl that was the only one not to get a puck,sadness,18,
guilt_shame,burden,eennfur,"This, in top of my already terrible mental health, is the reason why I'm severely underweight and need help.",sadness,19,
guilt_shame,burden,eeklrmu,"I was assaulted by my father once too. Please don’t hate yourself, it was not your fault. It was his doing. ",sadness,21,
guilt_shame,burden,ed428pp,Large weight fluctuations + a baby have caused my body to look cute in clothes -- Not so cute without them.,embarrassment,21,
guilt_shame,burden,eemr0vc,Right there with you. 20 years together and suddenly its over. I'm tired of crying and hurting. We'll get through this.,sadness,21,
guilt_shame,burden,eeke6kg,The part where he carries her to the car had me howling! Poor guy was stumbling with the weight he obviously couldn’t handle,sadness,23,
guilt_shame,burden,ee2ojgg,"Oh no. Your poor friend, I hope she can move past it someday. That has to be such a hard burden to carry.","optimism, sadness",23,
guilt_shame,burden,ed3q02w,"My knees, I had to quit running because they got so bad. Even hiking starts hurting after awhile, especially on long downhills Also glasses and deep voices","disappointment, sadness",27,
guilt_shame,burden,ed42h26,I am embarrassed to admit that I was shocked to find out that his books all had the same exact weight and that you knew what that weight was...,embarrassment,29,
guilt_shame,failure,ef8cbul,I'm disappointed that this isn't real...,disappointment,6,
guilt_shame,failure,ed0ivk1,I regret looking at his posts.,remorse,6,
guilt_shame,failure,eet3hns,He will regret nothing I'm sure,"remorse, neutral",6,
guilt_shame,failure,ee651ux,Sorry I should have said army.,remorse,6,
guilt_shame,failure,ef0rsb1,Never worked on my babies. So disappointing,disappointment,7,
guilt_shame,failure,ee18oid,I regret that I understand that reference :(,remorse,8,
guilt_shame,failure,ed122p6,I feel digestive regret just looking at them.,"disappointment, remorse, sadness",8,
guilt_shame,failure,ed6cg27,I always move back and always regret it.,"disappointment, sadness",8,
guilt_shame,failure,ef4o0fy,My mistake. I just glanced over your last post.,"disappointment, remorse",9,
guilt_shame,failure,eezbpwv,"My bad. I typo'd. It should have said ""how"".",disappointment,9,
guilt_shame,failure,edddu7s,Jeepers I should have been asleep two hours ago,"annoyance, disappointment",9,
guilt_shame,failure,efgpp1c,":( disappointed, i expected to give out personal therapy cats.",disappointment,10,
guilt_shame,failure,eep1un6,I thought it was mildly interesting and don't regret watching it.,remorse,11,
guilt_shame,failure,eesn5ua,My only regret will be posting this on my alt account.,remorse,11,
guilt_shame,failure,eesz52n,"Apologies, I should have been more specific. Where abouts is JD? ",remorse,11,
guilt_shame,failure,ed5ahzl,I'm disappointed by him not bragging about his 99 level atheism.,"disappointment, realization",11,
guilt_shame,failure,eeucvnt,"I regret this knowledge, give me back my ignorance damn it!",remorse,11,
guilt_shame,failure,edy1rlg,"as a kpop stan and a army, i am very disappointed",disappointment,11,
guilt_shame,failure,edls02o,Running a company will be the same disappointment. Your problem is unsolved.,"disappointment, disapproval",12,
guilt_shame,failure,eei6nwr,"Yeah I cannot either on mobile, same with enough internet. Thoroughly disappointing.",disappointment,12,
guilt_shame,failure,eel6gvc,I have a bad feeling I’m gonna regret not tuning into this,remorse,12,
guilt_shame,failure,ef9qyfi,He's a garbage person. It's very disappointing. I liked him so much before.,disappointment,13,
guilt_shame,failure,ed14xn5,"Discuss equality, be labeled troll. Good bye. I am so disappointed. In humanity.",disappointment,13,
guilt_shame,failure,ef9u2jy,"The fact that this podcast isn't called ""Z-Targeting Dio's Balls"" disappoints me greatly.",disappointment,13,
guilt_shame,failure,ee2cqru,"I failed with my play on words. Oh well, can't win them all",remorse,13,
guilt_shame,failure,edo7jf7,"You know, I'm rather disappointed, but admire your cunning at the same time",disappointment,13,
guilt_shame,failure,ed1h3e8,I know right I was very disappointed when I saw who it was,"approval, disappointment",13,
guilt_shame,failure,ef1lw6h,Me am be failed English and am unfaulted teacher not even frum England,disappointment,13,
guilt_shame,failure,ef7iq2u,I'm so sorry you were bullied in a place you should have felt safe.,"remorse, sadness",14,
guilt_shame,failure,ed9a5b5,I am 33 and I still regret things I said in the 5th grade.,sadness,14,
